{
  "name": "MEKANOMANCER",
  "duration": 34,
  "timeSignature": {
    "bpm": 180,
    "signature": 3
  },
  "soundTrack": "mekanomancer.mp3",
  "vfx": [],
  "atoms": {
    "travelTime": 8,
    "barsInterval": 2
  },
  "paddles": {
    "angle": 30,
    "duration": 3
  },
  "lives": 4,
  "additionalGameMechanics": [
    "atom capture",
    "supercharged atom",
    "charged atom catch"
  ],
  "tip": [
    "A supercharged atom will appear.",
    "It's fast and extremely valuable."
  ]
}
