{
  "name": "NEUTRONIKA",
  "duration": 66,
  "timeSignature": {
    "bpm": 120,
    "signature": 4
  },
  "soundTrack": "neutronika.mp3",
  "vfx": [],
  "atoms": {
    "travelTime": 4,
    "barsInterval": 1
  },
  "paddles": {
    "angle": 30,
    "duration": 3
  },
  "lives": 3,
  "additionalGameMechanics": []
}
